<?xml version="1.0" encoding="utf-8"?>
<!DOCTYPE chapter SYSTEM "../../etc/documentation.dtd">
<chapter name="Appendix" id="appendix">
	<section name="Glossary" id="glossary">
		<paragraph>${software} uses a number of terms you should know when working with the
		application.</paragraph>
		<subsection name="Interface Elements" id="glossary_gui">
			<list>
				<item name="Contextual Menu">The menu that appears when you
				control-click something (with a two-button mouse you can also
				right-click) and gives access to frequently used commands that deal
				directly with the clicked object. Read more about the available
				contextual menus in the 
				<reference chapter="views">"Views"</reference>and 
				<reference chapter="windows">"Windows" chapters.</reference></item>
				<item name="View/Edit Pane">A part of the ${software} 
				<reference chapter="windows" section="main">main
				window</reference>that lets you view a document or, if possible,
				edit it. The view/edit pane displays 
				<reference chapter="views">different views</reference>depending on
				the type of document it shows.</item>
				<item name="View (1)">The layout for a ${software} 
				<reference chapter="windows" section="main">main
				window.</reference>You can change the layout with the commands in
				the 
				<reference chapter="menus" section="view">View
				menu.</reference></item>
				<item name="View (2)">The display for the various document types
				inside the the view/edit 
				<phrase edition_le="no">pane or a 
				<reference chapter="windows" section="document">document
				window.</reference></phrase>
				<phrase edition_pe="no" edition_se="no">pane.</phrase>
				<reference chapter="views">Read more about views
				here.</reference></item>
				<item name="Window" edition_le="no">${software} uses three
				different types of windows, main, document and other windows. 
				<reference chapter="windows" section="main">Main
				windows</reference>show the hierarchy and, in some views, also the
				selected document, whereas 
				<reference chapter="windows" section="document">document
				windows</reference>show documents separately.</item>
				<item name="Window" edition_pe="no" edition_se="no">
				<reference chapter="windows" section="main">${software}
				windows</reference>show the group hierarchy and the selected
				document in the view/edit pane.</item>
			</list>
		</subsection>
		<subsection name="Documents &amp; Groups" id="glossary_documents">
			<list>
				<item name="Database">The collection of all documents stored in
				${software}.</item>
				<item name="Document" edition_le="no">A file in the database, for
				example a plain or RTF text, a PDF or an image. Technically an
				entry in the database with text, RTF, or image content. Sometimes
				referred to as "content".</item>
				<item name="Document" edition_pe="no" edition_se="no">A file in the
				database, a plain or RTF text, or a link. Technically an entry in
				the database with text or RTF content. Sometimes referred to as
				"content".</item>
				<item name="Group">A collection of documents or other groups inside
				the database. Similar to a folder in the file system.</item>
				<item name="Replicant">A second "incarnation" of a document or
				group. Unlike an alias in the file system, a replicant is not a
				real document pointing to another file, the original, but only a
				second entry in the table of contents for the very same document.
				Consequently, there is no original, when you replicate a document
				you'll end up with two replicants.</item>
				<item name="Sheet" edition_le="no" edition_pe="no">Sheets are
				collections of records, structured sets of data. You can use
				records to store for example addresses or list items and view all
				records of a sheet together in a 
				<reference chapter="views" section="sheet">table-like
				view.</reference>Sheets appear in hierarchy lists like folders with
				an expand/collapse triangle in front of their icon.</item>
			</list>
		</subsection>
		<subsection name="Item Properties" id="glossary_itemproperties">
			<list>
				<item name="State">To be done.</item>
			</list>
		</subsection>
	</section>
	<section name="Template tags for Wiki-style links" id="wikitemplates">
		<paragraph>When making a new document by marking some words in an RTF document,
		making them a link and clicking this link, ${software} creates the new document
		using a template you can define in the 
		<reference chapter="preferences" section="editing">preferences panel, "Editing"
		tab.</reference>In this template, you can use the tags below to automatically
		insert the name of the link, the current date or other information. 
		<reference chapter="menus" section="format" /></paragraph>
		<list>
			<item name="%@">Name of link</item>
			<item name="%%">A '%' character</item>
			<item name="%a">Abbreviated weekday name</item>
			<item name="%A">Full weekday name</item>
			<item name="%b">Abbreviated month name</item>
			<item name="%B">Full month name</item>
			<item name="%c">Shorthand for g%X %x", the locale format for date and
			time</item>
			<item name="%d">Day of the month as a decimal number (01-31)</item>
			<item name="%e">Same as %d but does not print the leading 0 for days 1
			through 9</item>
			<item name="%F">Milliseconds as a decimal number (000-999)</item>
			<item name="%H">Hour based on a 24-hour clock as a decimal number
			(00-23)</item>
			<item name="%I">Hour based on a 12-hour clock as a decimal number
			(01-12)</item>
			<item name="%j">Day of the year as a decimal number (001-366)</item>
			<item name="%m">Month as a decimal number (01-12)</item>
			<item name="%M">Minute as a decimal number (00-59)</item>
			<item name="%p">AM/PM designation for the locale</item>
			<item name="%S">Second as a decimal number (00-59)</item>
			<item name="%w">Weekday as a decimal number (0-6), where Sunday is 0</item>
			<item name="%x">Date using the date representation for the locale,
			including the time zone</item>
			<item name="%X">Time using the time representation for the locale</item>
			<item name="%y">Year without century (00-99)</item>
			<item name="%Y">Year with century (such as 1990)</item>
			<item name="%Z">Time zone name (such as Pacific Daylight Time)</item>
			<item name="%z">Time zone offset in hours and minutes from GMT
			(HHMM)</item>
		</list>
	</section>
</chapter>
